GO.ID	Term	Annotated	Significant	Expected	elimFisher
GO:0010839	negative regulation of keratinocyte proliferation	9	7	2.98	0.00792
GO:0030950	establishment or maintenance of actin cytoskeleton polarity	9	7	2.98	0.00792
GO:0043501	skeletal muscle adaptation	9	7	2.98	0.00792
GO:0051092	positive regulation of NF-kappaB transcription factor activity	9	7	2.98	0.00792
GO:0006027	glycosaminoglycan catabolic process	9	7	2.98	0.00792
GO:0014061	regulation of norepinephrine secretion	9	7	2.98	0.00792
GO:2000651	positive regulation of sodium ion transmembrane transporter activity	9	7	2.98	0.00792
GO:2001029	regulation of cellular glucuronidation	9	7	2.98	0.00792
GO:0010752	regulation of cGMP-mediated signaling	22	16	7.28	0.00797
GO:0043065	positive regulation of apoptotic process	111	60	36.75	0.00801
GO:1901214	regulation of neuron death	111	60	36.75	0.00801
GO:0046850	regulation of bone remodeling	15	10	4.97	0.00803
GO:0010345	suberin biosynthetic process	15	10	4.97	0.00803
GO:0031016	pancreas development	15	10	4.97	0.00803
GO:0010894	negative regulation of steroid biosynthetic process	15	10	4.97	0.00803
GO:0010872	regulation of cholesterol esterification	15	10	4.97	0.00803
GO:0060071	Wnt signaling pathway, planar cell polarity pathway	15	10	4.97	0.00803
GO:0071480	cellular response to gamma radiation	15	10	4.97	0.00803
GO:0042130	negative regulation of T cell proliferation	15	10	4.97	0.00803
GO:1903039	positive regulation of leukocyte cell-cell adhesion	47	24	15.56	0.0081
GO:0002237	response to molecule of bacterial origin	47	24	15.56	0.0081
GO:0050679	positive regulation of epithelial cell proliferation	47	24	15.56	0.0081
GO:0032502	developmental process	2781	1159	920.72	0.00815
GO:0001666	response to hypoxia	105	47	34.76	0.00821
GO:0048593	camera-type eye morphogenesis	42	26	13.91	0.00825
GO:0014051	gamma-aminobutyric acid secretion	27	19	8.94	0.00832
GO:0031111	negative regulation of microtubule polymerization or depolymerization	28	19	9.27	0.00832
GO:0009992	cellular water homeostasis	13	9	4.3	0.00836
GO:0042554	superoxide anion generation	13	9	4.3	0.00836
GO:0030326	embryonic limb morphogenesis	13	9	4.3	0.00836
GO:0045822	negative regulation of heart contraction	13	9	4.3	0.00836
GO:0090311	regulation of protein deacetylation	13	9	4.3	0.00836
GO:0032941	secretion by tissue	13	9	4.3	0.00836
GO:0090183	regulation of kidney development	13	9	4.3	0.00836
GO:0032787	monocarboxylic acid metabolic process	288	127	95.35	0.00838
GO:0002027	regulation of heart rate	37	24	12.25	0.0084
GO:0035641	locomotory exploration behavior	11	8	3.64	0.0084
GO:1900223	positive regulation of amyloid-beta clearance	11	8	3.64	0.0084
GO:0010749	regulation of nitric oxide mediated signal transduction	11	8	3.64	0.0084
GO:0032623	interleukin-2 production	11	8	3.64	0.0084
GO:0002691	regulation of cellular extravasation	11	8	3.64	0.0084
GO:0006000	fructose metabolic process	11	8	3.64	0.0084
GO:0010644	cell communication by electrical coupling	11	8	3.64	0.0084
GO:0007605	sensory perception of sound	11	8	3.64	0.0084
GO:0060412	ventricular septum morphogenesis	11	8	3.64	0.0084
GO:0120032	regulation of plasma membrane bounded cell projection assembly	129	64	42.71	0.00843
GO:0030317	flagellated sperm motility	52	26	17.22	0.00847
GO:1990138	neuron projection extension	52	26	17.22	0.00847
GO:1901889	negative regulation of cell junction assembly	26	15	8.61	0.00851
GO:0001658	branching involved in ureteric bud morphogenesis	26	15	8.61	0.00851
GO:0030032	lamellipodium assembly	26	15	8.61	0.00851
GO:0042220	response to cocaine	26	15	8.61	0.00851
GO:1904888	cranial skeletal system development	26	15	8.61	0.00851
GO:0045637	regulation of myeloid cell differentiation	83	43	27.48	0.0086
GO:0031532	actin cytoskeleton reorganization	40	21	13.24	0.00868
GO:0008652	cellular amino acid biosynthetic process	40	21	13.24	0.00868
GO:0043254	regulation of protein-containing complex assembly	166	70	54.96	0.00869
GO:0046889	positive regulation of lipid biosynthetic process	62	30	20.53	0.0088
GO:0042743	hydrogen peroxide metabolic process	33	18	10.93	0.00892
GO:0016525	negative regulation of angiogenesis	33	18	10.93	0.00892
GO:0001505	regulation of neurotransmitter levels	188	95	62.24	0.00909
GO:0043270	positive regulation of ion transport	144	81	47.67	0.00913
GO:1904064	positive regulation of cation transmembrane transport	54	30	17.88	0.00919
GO:2000300	regulation of synaptic vesicle exocytosis	45	23	14.9	0.00931
GO:0046928	regulation of neurotransmitter secretion	69	37	22.84	0.00943
GO:0006928	movement of cell or subcellular component	659	316	218.18	0.0095
GO:2001237	negative regulation of extrinsic apoptotic signaling pathway	24	14	7.95	0.00962
GO:0030521	androgen receptor signaling pathway	24	14	7.95	0.00962
GO:0090325	regulation of locomotion involved in locomotory behavior	24	14	7.95	0.00962
GO:1902679	negative regulation of RNA biosynthetic process	259	104	85.75	0.00962
GO:0021700	developmental maturation	149	76	49.33	0.00967
GO:0007632	visual behavior	50	25	16.55	0.00973
GO:0050767	regulation of neurogenesis	69	37	22.84	0.00991
GO:0008361	regulation of cell size	78	40	25.82	0.00992
GO:0009056	catabolic process	1184	442	391.99	0.00992
GO:0060322	head development	196	95	64.89	0.00995
GO:0048565	digestive tract development	38	20	12.58	0.00997
